{
  "date": "2026-08-07",
  "search_window": "7d",
  "reading_time": "约 7 分钟",
  "topics": [
    "滑板视觉文化",
    "AI 立法透明度",
    "女性流亡档案",
    "东亚社会实践影像",
    "摄影艺术征件"
  ],
  "why_today": "今天的信号聚焦在媒介信任、个体档案与空间自主。欧盟 AI 法案透明度条款的落地，在技术底层重构了合成图像的信用标记；而女摄影师 Lisel Haas 的流亡档案重光、台北的社会实践特展，则在历史与地缘的缝隙里，展示了身体和媒介抵抗遗忘的自主力量。",
  "intro": "本期简报探讨媒介如何在制度与现实之间重建可信度和叙事力量。我们关注欧盟 AI 法案新规对创作流的实际约束，并推介多项关于性别、劳作与亚文化的影像历史研究与最新展讯。",
  "opening_signal": "档案不仅是历史的证词，也是流亡者在黑暗中寻找同类的火光。",
  "closing_signal": "当法律开始强制为每一张合成图像打上水印，视觉真实的定义已不再属于肉眼，而属于算法元数据的博弈。但在算法之外，那些肉身在街头、在工厂、在流亡中的记录，依然在用最朴素的物质性抵抗着均质化的技术抹除。",
  "stories": [
    {
      "section": "Visual Culture Signal",
      "continuity": "New",
      "title_zh": "Fotografiska 上海举办《Skate of the Art》群展：通过 20 多位国内外艺术家的影像回溯滑板亚文化半世纪的视觉演变",
      "title_en": "Skate of the Art: Skateboarding Across Cultures",
      "summary_zh": "上海 Fotografiska 举办滑板视觉文化群展，展期至2026年10月25日。展览汇集了来自五大洲的 20 多位摄影师与艺术家的作品，其中包括比拉力、饶颂晖、谢石等中国本土创作者，以及 Ed Templeton、Larry Clark 等国际摄影先锋。展览通过照片、影像装置与多媒体媒介，追溯了滑板文化从1970年代加州起步到如今全球化及本土化演变的过程，呈现镜头如何塑造并推动这一街头运动与社群的发展。",
      "summary_en": "Fotografiska Shanghai presents a group exhibition tracing the 50-year evolution of skate culture. Featuring works by over 20 global and Chinese artists, the show explores how the camera lens has shaped skateboarding from a California subculture into a worldwide phenomenon.",
      "why_muki_cares": "这项展览不仅是关于极限运动的记录，更是将滑板作为一种身体实践与空间占领的视觉档案。对于研究民间亚文化、非正式社群影像以及街头摄影媒介考古具有直接的研究参考价值。",
      "editorial_signal": "街头摄影不仅记录了身体的跃动，也构建了不屈服于城市规训的替代性空间档案。",
      "theme_tags": [
        "Skate of the Art",
        "Fotografiska Shanghai",
        "street photography",
        "subculture",
        "vernacular archive",
        "body practice",
        "space politics"
      ],
      "source_name": "Fotografiska Shanghai",
      "source_url": "https://vertexaisearch.cloud.google.com/grounding-api-redirect/AUZIYQHKRUCh9HPolD_p5qfCWZOJjnY2R66I5mNXd1XKvjX_DpPKDwZWKDnnBatKr97Jyo-78svZGfeZYNJlMc48t-yXumghLqFtvUw2jxkTS5Bd1WibDNBj4S20_sOPQw25w_Wmjn3_-MUz6WsVECvkosk8sg6BVTWe",
      "publication_date": "2026-07-24",
      "image_url": null,
      "image_caption": null
    },
    {
      "section": "AI Research / Creative Tech Signal",
      "continuity": "New",
      "title_zh": "欧盟《人工智能法案》第 50 条透明度义务正式生效：合成媒介与 AI 交互必须进行机器可读标记",
      "title_en": "EU AI Act Article 50: Transparency Obligations Take Effect",
      "summary_zh": "2026年8月2日，欧盟《人工智能法案》中备受关注的第 50 条透明度条款正式落地。新规强制要求对话式 AI 系统（如聊天机器人）明确告知用户其 AI 身份，并规定所有生成式 AI 系统提供商必须对生成的图像、音频、视频等合成内容进行机器可读的隐式标记与水印。对于深伪内容（Deepfakes），部署者也须显著披露其人工修改属性。违规者将面临最高1500万欧元或全球年营业额3%的罚款。",
      "summary_en": "The transparency obligations under Article 50 of the EU AI Act officially took effect on August 2, 2026. The law mandates that generative AI providers mark synthetic media in a machine-readable format and disclose deepfakes, under threat of substantial global fines.",
      "why_muki_cares": "这并非单纯的法律条文，而是创意技术底层基础设施的系统性重构。新规将深度改变内容生成、创意工作流以及数字资产分发的元数据管理，对追踪信息完整性、媒介可信度和图像溯源非常关键。",
      "editorial_signal": "法律强制介入图像元数据，标志着生成式媒介可信度博弈已进入底层协议层。",
      "theme_tags": [
        "EU AI Act",
        "Article 50",
        "transparency obligations",
        "metadata watermarking",
        "media integrity",
        "forensics",
        "creative workflow"
      ],
      "source_name": "BSA TechPost Analysis",
      "source_url": "https://vertexaisearch.cloud.google.com/grounding-api-redirect/AUZIYQGl_JzDv93uiock6gEUz5YWIkzdZoRsWoupDYlVB1HYoXdYU8HtRfUQhvLU0kh-Q4fXsGQJS_0MN08h9dYkVclkea684S3GaWryBZEA7dIGozj3JBCPyGtqzMfdW8N2SHpljVUs4YaWpta_h-t7K00V5V_AglQRM0ZgRiQhHOlRpNecPd5GZa0u2QAjDEToFtVbM1BHTsoAPfAuV2k=",
      "publication_date": "2026-08-02",
      "image_url": null,
      "image_caption": null
    },
    {
      "section": "Feminist Structure Signal",
      "continuity": "New",
      "title_zh": "伯明翰图书馆整理公开女摄影师 Lisel Haas 档案：以家族史料重拾流亡背景下的女性伴侣关系与合作抗争",
      "title_en": "Discovering Lisel Haas: Lesbian Life of Photographer Who Fled Nazi Germany Brought into Focus",
      "summary_zh": "伯明翰图书馆展出德国犹太裔女摄影师 Lisel Haas（1898–1989）的个人文献展，展期至2026年12月12日。Haas 于1938年因纳粹迫害逃离德国，后与伴侣 Grete Bermbach 在英国共同经营摄影工作室。此批包含 258 盒照片、信件和工具的档案在国家档案基金资助下完成编目，展览首次通过 Haas 的剧院摄影及家族后代提供的私人回忆录，公开两人被历史遮蔽的同性伴侣关系与合作生存细节，并引入当代多位艺术家的视觉回应。",
      "summary_en": "The Library of Birmingham exhibits the archive of German-Jewish refugee photographer Lisel Haas. Newly cataloged files, supplemented by family memoirs, reveal her historical domestic and professional partnership with Grete Bermbach, resisting wartime erasure.",
      "why_muki_cares": "这是一个“通过私人记忆激活制度档案”的绝佳方法论案例。它展现了流亡语境下，女性伴侣关系与共同劳作如何作为一种抵抗性的生存策略，并为酷儿与女性主义档案挖掘提供了具体研究范式。",
      "editorial_signal": "散落在家族后代手中的私人叙事，是抵抗制度化遗忘和重写酷儿艺术史的关键拼图。",
      "theme_tags": [
        "Lisel Haas",
        "Library of Birmingham",
        "refugee history",
        "lesbian visibility",
        "feminist archive",
        "theater photography",
        "collaborative cataloging"
      ],
      "source_name": "Library of Birmingham",
      "source_url": "https://vertexaisearch.cloud.google.com/grounding-api-redirect/AUZIYQH0w_2-XECTMROHXT0YI0NWs4yuSM--u3dySOUm3dFmcdJDYFtG9cndNk2s9sOK5WhOprHJm0JmEOXb2Y4_ypz4FkXDY-ZQk7zq03OmDAssHxExg8TNHjiQtAQhE7a9IBpsvS-BY44MC8zurz8sgqc6tl7J7fNOMwQUi-RRpWWrQhflfwd-dfCFsOzG2eW9gnvjOm6_6pxz3XFHv16eprg=",
      "publication_date": "2026-07-27",
      "image_url": null,
      "image_caption": null
    },
    {
      "section": "China / East Asia Signal",
      "continuity": "New",
      "title_zh": "台北世界画廊举办《文字在房间里，被推迟》特展：通过流动影像与社会实践呈现东亚地缘中的劳作与身体叙事",
      "title_en": "Text in the Room, Deferred",
      "summary_zh": "台北世界画廊（Galerie du Monde）举办由王婧策划的群展《文字在房间里，被推迟》，展出至2026年9月5日。展览召集了蔡国杰、刘伟伟、徐坦、黄咏瑶等六位来自大中华区的艺术家，通过动态影像与社会参与式艺术，探讨当下的集体焦虑与社会碎片化。其中，徐坦的影像作品记录了中国深层父权农村语境下的女性言语与生存经验，而刘伟伟则通过一项法律艺术实验，由工厂工人投票决定其工作纪实画面的公共发布，直指地缘劳作与监控边界。",
      "summary_en": "Galerie du Monde Taipei presents \"Text in the Room, Deferred,\" curated by Wang Jing. Featuring social-practice videos from six regional artists, the show highlights labor dynamics, factory surveillance experiments, and rural women's narratives.",
      "why_muki_cares": "展览深入触及了东亚地缘中的社会实践和劳作结构。尤其是工人自主投票决定影像公开的法律实验，以及农村妇女话语的田野记录，为我们研究移动影像、媒体权力及身体政治提供了深刻的本土化参照。",
      "editorial_signal": "社会参与式影像正成为一种温和但坚韧的制度性反思，将监控摄像头下的劳作者重新带回叙事主体。",
      "theme_tags": [
        "Galerie du Monde",
        "Wang Jing",
        "social practice",
        "moving image",
        "labor structures",
        "women narratives",
        "Taiwanese contemporary art"
      ],
      "source_name": "Galerie du Monde",
      "source_url": "https://vertexaisearch.cloud.google.com/grounding-api-redirect/AUZIYQHaMfTCdwDBKd9vG3LcI52qvpvlB92rdVP9hn6HEoZMoo3XneoiByH-5pDgz3ifgUpo1urXZaJEAFPhw6yzWzMVEqs58Ukz--Xvh7rsIxFZIBUJaDJZYJz0RfxA93Vo1jOzC1KvxQiV3oT24z0J8O6KD7qDE1i2A98-sW39jFj9kT8ZoqoFFboQaxHzya8=",
      "publication_date": "2026-07-09",
      "image_url": null,
      "image_caption": null
    },
    {
      "section": "Archive / Long Read / Opportunity",
      "continuity": "New",
      "title_zh": "韩国 CICA 美术馆启动“Photography Now 2027”国际征件：支持多样媒介与 AI 介入的影像实验",
      "title_en": "CICA Museum International Exhibition: Photography Now 2027 Open Call",
      "summary_zh": "韩国金浦 CICA 美术馆现面向全球影像创作者启动“Photography Now 2027”群展征集，申请截止日期为2026年8月20日。该项目欢迎包括传统摄影、数字影像、媒介操纵以及 AI 生成图像在内的广泛实验。入选作品将于2027年4月展出，且美术馆对数字形式作品提供便利支持——入选者可由美术馆协助在 A3 泡沫板上直接打印展出，大幅度简化了跨国实体运输的复杂流程与成本。",
      "summary_en": "South Korea's CICA Museum opens submissions for the \"Photography Now 2027\" international exhibition. The open call accepts traditional, digital, and AI-manipulated photography, offering digital-to-print exhibition assistance.",
      "why_muki_cares": "这是一个极具实操性的高品质亚太区机构征件机会。其对 AI 生成和媒介操纵等混合影像形式的包容态度，十分契合多媒介创作者的实践工作流，且提供了一套规避高昂国际物流成本的布展方案。",
      "editorial_signal": "实体布展方案的轻量化重构，正在消解地缘物理边界对数字和计算影像创作者的阻碍。",
      "theme_tags": [
        "CICA Museum",
        "open call",
        "Photography Now 2027",
        "AI generated photography",
        "digital art",
        "exhibition opportunity",
        "South Korea"
      ],
      "source_name": "ArtDeadline",
      "source_url": "https://vertexaisearch.cloud.google.com/grounding-api-redirect/AUZIYQG2rFu4VxTWSIoWUrI_YrS2LbtnlPp_o3sWze8j-iYRjLLyVnn2C48eqeP5ssHkibsZcZ3QZDoxCajX6jcM_mUrJd0_9VeEBIHmyUUjL7FdkUKTB_lEuQY=",
      "publication_date": null,
      "image_url": null,
      "image_caption": null
    }
  ],
  "editors_pick": {
    "type": "Feminist Structure Signal",
    "title": "伯明翰图书馆整理公开女摄影师 Lisel Haas 档案：以家族史料重拾流亡背景下的女性伴侣关系与合作抗争",
    "why_muki_may_care": "推荐这篇是因为它为如何通过“家族史料”去对抗机制性的编目遗忘提供了极好的实操案例。Haas 的档案不仅补足了欧洲剧院摄影史的拼图，更是将女性在流散中相互协作、共同运营摄影室的生存政治带回了历史主流，是一次真正温情且具方法论启发的档案重构。",
    "link": "https://vertexaisearch.cloud.google.com/grounding-api-redirect/AUZIYQH0w_2-XECTMROHXT0YI0NWs4yuSM--u3dySOUm3dFmcdJDYFtG9cndNk2s9sOK5WhOprHJm0JmEOXb2Y4_ypz4FkXDY-ZQk7zq03OmDAssHxExg8TNHjiQtAQhE7a9IBpsvS-BY44MC8zurz8sgqc6tl7J7fNOMwQUi-RRpWWrQhflfwd-dfCFsOzG2eW9gnvjOm6_6pxz3XFHv16eprg="
  },
  "empty_sections": [],
  "excluded_topics": [
    "Voluntary AI icons (omitted due to lack of standard formal institutional endorsement and speculative nature)",
    "Bypass watermarking tools (excluded to maintain research standards and prevent promoting unreliable software)"
  ],
  "covered_entities": [
    "Fotografiska Shanghai",
    "Library of Birmingham",
    "Galerie du Monde",
    "CICA Museum",
    "BSA Group"
  ],
  "repetition_notes": "本期所有信号均为全新（New）线索。欧盟 AI 法案第 50 条透明度义务的生效，承接了 8 月 4 日简报关于谷歌空间 AI 撤回事件和地图虚构危机的探讨，从法律底层为数字时代的图像元数据信任确立了边界。台北世界画廊的社会实践群展则与 8 月 3 日新北美术馆的《民间/摄影》特展形成有趣的当代遥呼，它们都将目光投向了非官方空间中，作为抵抗和反思载体的地缘身体与劳作影像。",
  "issue_number": 29
}
