{
  "date": "2026-09-03",
  "search_window": "30d",
  "reading_time": "约 8 分钟",
  "topics": [
    "私家生活档案",
    "家庭剧场摆拍",
    "感光材质消亡",
    "原生 3D 生成",
    "传统银盐暗房",
    "女性身体衰老",
    "媒介考古驻留"
  ],
  "why_today": "今天的信号全部指向了物理材料、身体张力与微观日常的深度碰撞。无论是在漫长的家庭照片流中折射地缘创伤，还是用编排的剧场逼视女性身体衰老的恐惧；无论是将传统感光工业的衰退转化为空间照片雕塑，还是在实体暗房的湿版洗印中重温劳作，这些实践都与 ComfyUI 逐步成熟的原生 3D 本地管线形成了一种张力——我们在数字中重构三维物质，又在物理介质里打磨记忆。",
  "intro": "本期简报聚焦于微观日常档案与物理材料的媒介重塑。从历时25年的家庭影像书，到对家政权力与女性衰老身体展开摆拍探索的艺术回顾；从结合明代文本与传统银盐工业消亡史的东亚艺术实践，到本地 3D 核心模型生态的原生化升级，以及紧邻大师贝伦尼斯·雅培故居的物理暗房驻留项目。这些信号表明，在数字洪流中，创作者正在向微观物理空间、身体日常和手工暗房工艺进行深度的物质性回归。",
  "opening_signal": "“在漫长的时光流逝中，家庭既是庇护所，也是一切权力关系和历史灾难无声降临的剧场。”",
  "closing_signal": "从底片的银盐微粒到生成的 3D 网格，图像正在彻底摆脱平面纸张的束缚。这种向空间深度和物质触觉的回归，或许正是我们在虚无的数字信息洪流中，重新确认肉身与记忆锚点的方式。",
  "stories": [
    {
      "section": "Visual Culture Signal",
      "continuity": "New",
      "title_zh": "独立出版物《Chronograph》发行：尼克·海姆斯以 25 年家庭影像重组日常张力与社会历史",
      "title_en": "SPBH Editions Publishes \"Chronograph\" by Nick Haymes: 25 Years of Family Archives Intersecting Private Lives and Public Trauma",
      "summary_zh": "英国独立出版社 MACK 旗下的 SPBH Editions 推出摄影师尼克·海姆斯（Nick Haymes）历时 25 年完成的摄影书《Chronograph》。本书厚达 450 多页，收录了近 1000 张图像，记录了海姆斯与其伴侣和两个孩子在 2001 至 2026 年间的家庭生活。叙事从 2001 年 9·11 事件爆发时距离现场仅一个街区拍下的瞬间开始，随后滑入日常的度假与起居。作品避开了感伤的家庭温情，将家庭生活呈现为一个心理充满矛盾与张力的流动场域。",
      "summary_en": "SPBH Editions releases Nick Haymes's 450-page photobook \"Chronograph,\" compiling nearly 1,000 images taken between 2001 and 2026 that document his family's life alongside major historical shifts starting from 9/11.",
      "why_muki_cares": "本书展示了微观私人档案与宏大历史事件的交织方式。它不仅是个人生活史的记录，也为图像历史学者研究“微观日常档案”如何承载地缘政治创伤提供了一个长达四分之一世纪的扎实范本。",
      "editorial_signal": "长期微观档案与公共历史灾难的交融",
      "theme_tags": [
        "Nick Haymes",
        "SPBH Editions",
        "MACK Books",
        "photobook",
        "family archive",
        "vernacular photography",
        "9/11"
      ],
      "source_name": "MACK Books",
      "source_url": "https://vertexaisearch.cloud.google.com/grounding-api-redirect/AUZIYQHngHMOARwvCREcpbAQpcx-jwbLVX5LkR0yjAoPFy1K06T7oFrjgqU2ZpbvATknrY8t9MBCkgbl_M0a5tgs1rPqpyK2jJO_A0cI3o6xdIma90cvUqX3VZRBvcCm3ixVeqH3sxzj3KNUIJmAYMrwng==",
      "publication_date": "2026-08-28",
      "image_url": null,
      "image_caption": null
    },
    {
      "section": "Feminist Structure Signal",
      "continuity": "New",
      "title_zh": "LACMA 举办艾琳·考文首个美术馆回顾展：在日常剧场中审视家政劳作、身体退化与亲密控制",
      "title_en": "LACMA Presents Eileen Cowin's First Museum Retrospective \"Between Panic and Paradise\"",
      "summary_zh": "洛杉矶郡立艺术博物馆（LACMA）推出洛杉矶本土艺术家艾琳·考文（Eileen Cowin）首个大型回顾展，呈现其 1967 至 2025 年创作的 50 多件摄影、视频和混合媒介装置。展出重点包括她早期结合大众媒体图像的透明感光层转印实验，1970年代经典的摆拍“家庭家庭剧”系列，以及直面衰老与死亡焦虑的新作《Another Year Closer to Death》。展览采用碎片化、非线性的展陈设计，打破了传统的生命时间轴。",
      "summary_en": "LACMA hosts the first major museum retrospective of Los Angeles-based artist Eileen Cowin, showcasing nearly 60 years of photographic and video works that challenge domestic intimacy, aging, and media representation.",
      "why_muki_cares": "考文是 1970 年代南加州实验摄影的代表。她通过精心编排的“家庭剧场”解构了家政劳动与关护关系中的权力控制。其新作对老年女性身体衰退的坦率记录，为女性主义身体与晚期生命写作提供了关键的视觉档案。",
      "editorial_signal": "用摆拍剧场解构家政权力与身体衰退",
      "theme_tags": [
        "Eileen Cowin",
        "LACMA",
        "staged photography",
        "feminist photography",
        "body politics",
        "aging",
        "domestic labor"
      ],
      "source_name": "LACMA",
      "source_url": "https://vertexaisearch.cloud.google.com/grounding-api-redirect/AUZIYQGdo949YZcpjxS3B-U7l2i1BIrTLe0ypijeJFukcJlsQCmL4DaUG_NO1GOiCjoV0eG3q7Vvn9z_N-SBVXqZHzZGgJ8c48gb0NvJVacLHe8WRYuSX8goJPY7WjhmCcprgN-hVxyRdEulinzcv6aXI7QRb6IW6ZthAkBsGQ==",
      "publication_date": "2026-08-23",
      "image_url": null,
      "image_caption": null
    },
    {
      "section": "China / East Asia Signal",
      "continuity": "New",
      "title_zh": "花代京都个展《Hanayo V》将开幕：以中国古典典故、纸质书信与照片雕塑重构地缘记忆",
      "title_en": "Taka Ishii Gallery Kyoto Announces Hanayo's Solo Exhibition \"Hanayo V\" Mapping Local Rituals and Media Archeology",
      "summary_zh": "京都 Taka Ishii Gallery 将于 9 月 6 日推出传奇女性艺术家花代（Hanayo）的个展《Hanayo V》，庆祝双方合作 30 周年。花代此次关注画廊所在地矢田町流传千年的“伯牙山”祭具地缘历史，借用明代小说中伯牙与子期的知音典故，创作了全新影像与雕塑。展览除了展出她经典的木盒“照片雕塑”外，还将结合她的手写书信、舞蹈，以及对富士胶片等传统感光工业消亡的物质性反思。",
      "summary_en": "Taka Ishii Gallery Kyoto will present Hanayo's solo exhibition \"Hanayo V,\" blending the local Gion Matsuri folklore, classical Chinese texts, and photo-sculptures to reflect on analog material cultural loss.",
      "why_muki_cares": "花代用半格相机捕捉的模糊私密日常构成了东亚女性日常感官的经典记录。本次展览将地方祭祀、明代文本、传统银盐感光材料消亡史与女性私人书信织在一起，展示了东亚摄影实践如何走向一种更深层的媒介考古。",
      "editorial_signal": "东亚次文化女性摄影与传统工业消亡的媒介交织",
      "theme_tags": [
        "Hanayo",
        "Taka Ishii Gallery",
        "Gion Matsuri",
        "photo-sculpture",
        "media archaeology",
        "Japanese contemporary art",
        "silver gelatin"
      ],
      "source_name": "Taka Ishii Gallery",
      "source_url": "https://vertexaisearch.cloud.google.com/grounding-api-redirect/AUZIYQETLBbKHrjmGbgcYxYf-mXAADUQA0f2bbajrDUaN1CMez1jt1Y02GsqInaZIEJQ2HeGM1IvOnd03Gegw3E_JEp27io1OQcZNOkDiyXYUmr6NI3wYBFe3HeF6Fk=",
      "publication_date": null,
      "image_url": null,
      "image_caption": null
    },
    {
      "section": "AI Research / Creative Tech Signal",
      "continuity": "Follow-up",
      "title_zh": "ComfyUI 内核合并 Trellis.2 与 Pixal3D：免编译运行 3D 原生工作流与 PBR 材质烘焙",
      "title_en": "Trellis.2 and Pixal3D Integrated into ComfyUI Core, Enabling Native Image-to-3D Workflows",
      "summary_zh": "ComfyUI 发布重大底层更新，将微软开源的 3D 生成模型 Trellis.2 以及腾讯 ARC 实验室与清华大学发表的像素级对齐模型 Pixal3D 合并入核心内核。此次升级完全摆脱了第三方节点和复杂的 CUDA 编译依赖，将 PBR 纹理贴图和 3D 网格后处理重构为 PyTorch 和 SciPy 原生实现。用户升级至 v0.34.0 版本后即可免配置运行这两个模型，新工作流还支持网格重构、减面和法线烘焙等商业级 3D 资产导出。",
      "summary_en": "ComfyUI has integrated Trellis.2 and Pixal3D into its core repository, eliminating complex CUDA compilation requirements and enabling native, streamlined Image-to-3D generation pipelines.",
      "why_muki_cares": "这项更新扫清了图像向三维实体转化中的技术壁垒。对于关注媒介考古与数字物质性的创作者来说，它让 AI 辅助的虚拟空间搭建、历史档案 3D 化和混合媒介叙事可以直接在消费级硬件的本地环境中低门槛、无缝地进行。",
      "editorial_signal": "Image-to-3D 本地管线的原生闭环与无痛部署",
      "theme_tags": [
        "ComfyUI",
        "Trellis.2",
        "Pixal3D",
        "3D generation",
        "PBR texture baking",
        "workflow automation",
        "creative technology"
      ],
      "source_name": "Substack",
      "source_url": "https://vertexaisearch.cloud.google.com/grounding-api-redirect/AUZIYQGpu-XxbAO8AmvzbV0d4svX9adouVNjvYFy8WTPkGIZFTrPQl4o0xjPviVuyRJ6lmq55RY7JII48OC2wkgd0Ynxb_YrtWk2ffVotwPxF4oejbyMD6mV-So1uhYKf5Ie-Kg6HPNIfYPlIFRcIIr61tva5A-05O-9G8BkSP7snk9UCLM_Rg==",
      "publication_date": "2026-08-31",
      "image_url": null,
      "image_caption": null
    },
    {
      "section": "Archive / Long Read / Opportunity",
      "continuity": "New",
      "title_zh": "缅因州雅培·沃茨摄影驻留启动招募：全额资助并提供 24 小时传统银盐暗房及数码后期混血工坊",
      "title_en": "Open Call: Abbott Watts Residency for Photography at Monson Arts with Access to Todd Watts Darkroom",
      "summary_zh": "位于美国缅因州的 Monson Arts 启动 2027 年冬季“雅培·沃茨摄影驻留”申请。该项目每年仅限 5 个名额，本次申请截止至 2026 年 9 月 15 日，面向为期四周的驻留。获选艺术家将获得独立居住卧室、独立工作室、所有餐饮以及 500 美元创作津贴。驻留的最大特色在于提供 24 小时无限制使用托德·沃茨私人暗房的特权，该工作室紧邻纪实女摄影师贝伦尼斯·雅培的故居，完美支持从传统湿版/银盐手工洗印到高精度数码扫描与打印的工艺融合。",
      "summary_en": "Monson Arts is accepting applications for the winter 2027 Abbott Watts Residency for Photography, providing selected artists with full funding and 24-hour access to the legendary Todd Watts darkroom.",
      "why_muki_cares": "这不仅是一个高额资助的驻留，更是一次与美国纪实摄影巨匠贝伦尼斯·雅培进行空间互文的媒介考古机会。其高规格的传统银盐与数码混合暗房，为探索图像的物质特性、暗房中的身体劳作提供了理想的实验场所。",
      "editorial_signal": "传统湿版银盐暗房与数码混血的工作坊驻留",
      "theme_tags": [
        "Abbott Watts Residency",
        "Monson Arts",
        "Berenice Abbott",
        "analog photography",
        "darkroom",
        "art residency",
        "open call",
        "funding opportunity"
      ],
      "source_name": "Monson Arts",
      "source_url": "https://vertexaisearch.cloud.google.com/grounding-api-redirect/AUZIYQHF1_HUXOK2F1ZBUAf0Rwt2wx6J9YZSn3YZOkbnwq2rTYgnp7vSRZheSQriAIey_oNqpIxF0X9gWNFH7q0vPmlOxI3gLygqjYfYXK53oCAtmP1mgerIHApPFTtg9-aWKoxxaOPcq6MU71VzDWGDkMgN",
      "publication_date": null,
      "image_url": null,
      "image_caption": null
    }
  ],
  "editors_pick": {
    "type": "Opportunity",
    "title": "缅因州雅培·沃茨摄影驻留启动招募：全额资助并提供 24 小时传统银盐暗房及数码后期混血工坊",
    "why_muki_may_care": "提供紧邻摄影大师贝伦尼斯·雅培故居的高规格模拟与数码暗房，在北林冰雪环境下的空间实践完美契合对图像物质性与媒介考古的探索。",
    "link": "https://vertexaisearch.cloud.google.com/grounding-api-redirect/AUZIYQHF1_HUXOK2F1ZBUAf0Rwt2wx6J9YZSn3YZOkbnwq2rTYgnp7vSRZheSQriAIey_oNqpIxF0X9gWNFH7q0vPmlOxI3gLygqjYfYXK53oCAtmP1mgerIHApPFTtg9-aWKoxxaOPcq6MU71VzDWGDkMgN"
  },
  "empty_sections": [],
  "excluded_topics": [
    "未有显著重复或不符合标准的排除项。"
  ],
  "covered_entities": [
    "SPBH Editions",
    "MACK Books",
    "LACMA",
    "Taka Ishii Gallery",
    "Comfy Org",
    "Monson Arts"
  ],
  "repetition_notes": "关于 ComfyUI 核心内核原生合并 Trellis.2 与 Pixal3D 的介绍，是对过去多期（如8月25日、31日等）中关于 ComfyUI 节点生态及 3D 原生模型演进的纵深技术跟进（Follow-up）。其余 4 个信号（包括尼克·海姆斯家庭史摄影书、艾琳·考文南加州回顾展、花代三十周年京都个展以及雅培·沃茨暗房驻留招募）均为全新的视觉、地缘策划与资助机会（New）。",
  "issue_number": 51
}
