{
  "date": "2026-08-27",
  "search_window": "30d",
  "reading_time": "约 8 分钟",
  "topics": [
    "草间弥生逝世",
    "女性环境艺术",
    "ComfyUI v0.34.0",
    "MiniMax H3",
    "世界新闻摄影展",
    "Art Omi 驻留",
    "声学空间",
    "女性主义空间实践"
  ],
  "why_today": "本期简报记录了先锋艺术史的关键转折与技术工作流的深层控制。东亚战后最重要的先锋女性艺术家草间弥生逝世，她的讣告与即将转化为致敬展的巡回回顾展，为我们拉开了历史的一道幕角。与此同时，首尔三星美术馆在女性先锋环境展中引入崔仲姬的声学空间实践，用声音重建身体感知；ComfyUI v0.34.0 版本的发布，则在算法端将多模态控制推向精确到帧的局部控制。这一系列信号共同揭示了艺术与技术在“空间-身体-控制”层面的重组。",
  "intro": "今日的简报聚焦于历史谱系的断代、身体空间的声学激活，以及多模态 AI 工具的精确工程化。我们试图在草间弥生艺术生命的落幕中，重新审视女性主义在 20 世纪下半叶所开创的环境艺术脉络。",
  "opening_signal": "在巨星陨落的静默中，历史环境的声学余韵与算法帧级的精确控制正互为镜像。",
  "closing_signal": "无论是那些将不可见创伤转化为实体底片的纪实瞬间，还是通过声音震动、算法噪波所划定的局部控制，媒介的权力始终在身体与空间的张力中重新分配。",
  "stories": [
    {
      "section": "China / East Asia Signal",
      "continuity": "New",
      "title_zh": "草间弥生逝世：享年 97 岁，回顾其战后前卫艺术生涯与美术馆巡展转型",
      "title_en": "Avant-Garde Legend Yayoi Kusama Dies at 97, Her Studio Releases Official Obituary",
      "summary_zh": "日本先锋艺术家草间弥生于2026年8月14日在东京因多器官衰竭逝世，享年97岁。其工作室于8月27日正式发布讣告，透露她直至生命最后几天依然在工作室坚持创作。草间原定于同年9月11日在阿姆斯特丹市立博物馆开幕的标志性回顾展（此前已在巴塞尔和科隆巡展），现将转为向其传奇生涯致敬的展览。目前私人葬礼已举行，后续将举办公共追悼会。",
      "summary_en": "Japanese avant-garde artist Yayoi Kusama passed away on August 14, 2026, at the age of 97. Her studio released an official obituary on August 27, announcing that her upcoming retrospective at the Stedelijk Museum in Amsterdam will be transformed into a tribute exhibition.",
      "why_muki_cares": "草间弥生作为战后最重要的女性艺术家之一，其对无限网点与镜面环境的探索深刻重构了身体叙事。她的逝世标志着一个时代的终结，其回顾展在美术馆制度层面的应对方式非常值得追踪。",
      "editorial_signal": "战后东亚女性先锋艺术史的代际告别与国际博物馆的致敬重组。",
      "theme_tags": [
        "Yayoi Kusama",
        "obituary",
        "Japanese avant-garde",
        "Stedelijk Museum",
        "East Asian art history",
        "feminist art history"
      ],
      "source_name": "Yayoi Kusama Official Website",
      "source_url": "https://vertexaisearch.cloud.google.com/grounding-api-redirect/AUZIYQGnyKIr5kkopBYNlpPnU_5WlHPtKemhDCd3QGOi4HtjRy_cgFwjgNfIbvY99ros-sCFIj5bUBFxHJOWbWryd2WuKUjZJ3rLsEyMFucjP_Y7TGkWVB4QTTow_Bc=",
      "publication_date": "2026-08-27",
      "image_url": null,
      "image_caption": null
    },
    {
      "section": "Feminist Structure Signal",
      "continuity": "New",
      "title_zh": "三星美术馆举办特别声音表演：在女性环境装置展中重构声学共鸣与身体感知",
      "title_en": "Leeum Museum of Art Announces Special Sound Performance within Historic Women's Environments Exhibition",
      "summary_zh": "首尔三星美术馆（Leeum）宣布将于2026年9月5日在其特展《在另一个空间里：女性艺术家的共感觉环境 1956–1976》内，在著名的《梦之屋》（1966至今）声音与光影装置中举办一场特别声音表演。现场将世界首演崔仲姬（Jung Hee Choi）的声学作品《Seven》（2024），该作使用了沃尔特·德·玛利亚于1966年为拉蒙特·扬制作的雕塑乐器，并配对演出了拉蒙特·扬使用罗伯特·莫里斯所制锣的先锋作品。该特展将展出至11月29日，通过重构11位女性艺术家的环境装置，重新评估被主流艺术史边缘化的空间实践。",
      "summary_en": "Seoul's Leeum Museum of Art will host a special sound performance featuring the world premiere of Jung Hee Choi's acoustic work alongside La Monte Young's classic. The event is set inside 'Dream House' as part of an exhibition re-evaluating historical environmental installations by 11 women artists.",
      "why_muki_cares": "此项目展示了早期女性艺术家如何以声学共鸣和触觉装置挑战极简主义的男性物质话语。崔仲姬对声学仪器的重演，为声音媒介、身体感知与女性空间实践的交叉研究提供了极佳的参考方法。",
      "editorial_signal": "以声学和触觉共鸣挑战男性物质主义，用身体感知重建女性主义空间档案。",
      "theme_tags": [
        "Jung Hee Choi",
        "La Monte Young",
        "Leeum Museum of Art",
        "Environments by Women Artists",
        "sound art",
        "feminist space",
        "sensory environments"
      ],
      "source_name": "e-flux Announcements",
      "source_url": "https://vertexaisearch.cloud.google.com/grounding-api-redirect/AUZIYQGRTAt_AUUSFWUjMlPq1iN75O2g_CaXt6hKTMyQXnS6HAxdB2dpJnKiw-PWnEGfE5MXOyMgS4qSn1JaZOEA5nqpEhqltki1wmD0n_dBXfcZO6YFx5wbQOz2Mv7ILZvo4VzNy9HM2s5HwhrDuEonPCo4n4rs77uPTv_2Khr1iJ2EXD-BzjxacGTzgtdQigNJvi4uOxQ-T0tv17P9O6k1kA==",
      "publication_date": "2026-08-27",
      "image_url": null,
      "image_caption": null
    },
    {
      "section": "AI Research / Creative Tech Signal",
      "continuity": "Follow-up",
      "title_zh": "ComfyUI 发布 v0.34.0 版本：原生支持 MiniMax H3 帧级锚定与噪波局部遮罩",
      "title_en": "ComfyUI Releases v0.34.0 with MiniMax H3 Anchor Guides and Per-Token Latent Noise Masking",
      "summary_zh": "ComfyUI 于2026年8月26日发布 v0.34.0 稳定版更新，针对音视频原生多模态模型 MiniMax H3 进行了关键底座级节点升级。新增的 `MiniMaxH3AddGuide` 节点，允许创作者在视频的任意指定帧上锚定图像与音频引导，打破了此前仅能在首尾帧进行控制的局限。新版还原生支持 per-token 的音视频潜空间噪波遮罩与提示词嵌入，并修复了对话标签破损问题，支持直接配合 Empty Latent Image 节点运行常规生图工作流。",
      "summary_en": "ComfyUI v0.34.0 introduces major native updates for the MiniMax H3 multimodal model, enabling creators to anchor image and audio guides on any frame via 'MiniMaxH3AddGuide' and perform per-token latent noise masking.",
      "why_muki_cares": "这是对 MiniMax H3 生态的技术跟进。更新标志着音视频多模态控制从首尾帧“盲盒生成”迈向精确到帧的遮罩控制，为使用本地工作流进行视听实验的创作者提供了更具掌控力的工具。",
      "editorial_signal": "音视频多模态 AI 工作流正式转向精确的时间轴与潜空间噪波局部遮罩控制。",
      "theme_tags": [
        "ComfyUI",
        "MiniMax H3",
        "latent noise masking",
        "workflow automation",
        "multimodal AI",
        "video generation",
        "creative technology"
      ],
      "source_name": "Comfy Org",
      "source_url": "https://vertexaisearch.cloud.google.com/grounding-api-redirect/AUZIYQHGXtflommGFhI0w_BLqRXQbXw4xyEbAUtH1DPQqtq6o388rvKzufoLKox0nAmT5Id--IJzzQbx4G5dhxKOYztXvjC_7eYGMvR5vI5MZG1LOxfmrpkJKA==",
      "publication_date": "2026-08-26",
      "image_url": null,
      "image_caption": null
    },
    {
      "section": "Visual Culture Signal",
      "continuity": "New",
      "title_zh": "世界新闻摄影展伦敦巡展开幕：以 42 位摄影师作品见证地缘政治与移民创伤",
      "title_en": "World Press Photo Exhibition 2026 Opens in London, Presenting Visual Stories from 42 Awarded Photographers",
      "summary_zh": "2026 年世界新闻摄影展伦敦巡展于 8 月 21 日在全新落成的 MPB 画廊开幕，展期至 9 月 30 日。本次展览汇集了从 141 个国家数万幅投稿中选出的 42 位获奖摄影师的作品。年度大奖作品为卡罗尔·古齐（Carol Guzy）记录厄瓜多尔移民被逮捕而骨肉分离的瞬间《Separated by ICE》。其他核心展项包括记录加沙人道危机的《Aid Emergency in Gaza》及记录危地马拉玛雅阿奇族女性寻求司法正义的纪实组画《The Trials of the Achi Women》。",
      "summary_en": "The World Press Photo Exhibition 2026 has opened at the new MPB Gallery in London, showcasing 42 visual narratives that capture pressing geopolitical realities, including Carol Guzy's grand prize winner and stories of indigenous women's resilience.",
      "why_muki_cares": "本展呈现了纪实摄影如何保持其见证效力。特别是将女性身体、地缘创伤与司法档案交织的影像记录，为探讨摄影媒介作为反叙事与对抗遗忘的历史工具提供了宝贵的一手现场。",
      "editorial_signal": "纪实摄影作为反叙事与非官方历史档案在地缘政治中的见证力量。",
      "theme_tags": [
        "World Press Photo",
        "Carol Guzy",
        "MPB Gallery",
        "documentary photography",
        "indigenous women",
        "migration politics"
      ],
      "source_name": "World Press Photo",
      "source_url": "https://vertexaisearch.cloud.google.com/grounding-api-redirect/AUZIYQEG0JZlCyVFpbFJYPryuXAod99EL5HTo9-OmELN8V0WfTikfYMrDl_uPQy0iRfducJgET9Zrmj9baAAvWqhnB_SvFio0XILGSpknGlEdeZUY4WOjd1_7WiuLjJRDA3vNO2YWqYxOx_wq_LkAeQoQppcVx-FOgLANHnO",
      "publication_date": "2026-08-21",
      "image_url": null,
      "image_caption": null
    },
    {
      "section": "Archive / Long Read / Opportunity",
      "continuity": "New",
      "title_zh": "Art Omi 启动 2027 年度国际驻留招募：全额资助多学科创作者对接纽约策展网络",
      "title_en": "Art Omi Launches 2027 International Residencies Open Call across Multiple Disciplines",
      "summary_zh": "位于美国哈德逊河谷的 Art Omi 艺术中心启动其 2027 年度跨学科国际驻留招募，涵盖艺术、建筑、舞蹈和音乐四个方向。通过评审的人选可免除费用，Art Omi 全额资助食宿、独立工作室和基本工具（自理差旅并交纳15美元申请费）。其中，视觉艺术家驻留定于2027年6月17日至7月12日举行，期间将邀请策展人及评论家进行工作室指导。截止日期方面，艺术家驻留为2026年9月14日，其余学科在 Submittable 平台上的截止日期为10月1日。",
      "summary_en": "Art Omi is accepting applications for its 2027 international residency programs across art, architecture, dance, and music. Selected residents will receive fully funded lodging, meals, and studio spaces, with the visual artists' deadline set for September 14, 2026.",
      "why_muki_cares": "这是一个享誉国际且高度跨学科的全额资助驻留项目。其独特的访客项目能让创作者直接连通纽约核心策展与画廊网络，对处于上升期的独立艺术研究者来说具有极高的专业发展价值。",
      "editorial_signal": "北美跨学科全额资助驻留机会，连通纽约画廊与策展网络的孵化器。",
      "theme_tags": [
        "Art Omi",
        "art residency",
        "visual arts residency",
        "architecture residency",
        "open call",
        "funding opportunity"
      ],
      "source_name": "Art Omi",
      "source_url": "https://vertexaisearch.cloud.google.com/grounding-api-redirect/AUZIYQHRATg-5OA1rQgtGZg4bLktlUYsyvSLtWVNZCMg4O0cPftlG_C6P0JPkpaiS6NwbhlmEEBeeMg74E2N1nRNk0llvPVG3vK846mmey51shpef9FySWzls3zDn7PrvYuT",
      "publication_date": "2026-08-19",
      "image_url": null,
      "image_caption": null
    }
  ],
  "editors_pick": {
    "type": "China / East Asia Signal",
    "title": "草间弥生逝世：享年 97 岁，回顾其战后前卫艺术生涯与美术馆巡展转型",
    "why_muki_may_care": "草间弥生作为战后最重要的女性艺术家之一，其对无限、网点与镜面环境的探索，不仅挑战了西方男性主导的极简与波普艺术，更深刻重构了东亚艺术家的身体叙事与媒介实践。她的逝世是一个时代的终结，其晚期创作状态和巡展转型的制度应对值得关注。",
    "link": "https://vertexaisearch.cloud.google.com/grounding-api-redirect/AUZIYQGnyKIr5kkopBYNlpPnU_5WlHPtKemhDCd3QGOi4HtjRy_cgFwjgNfIbvY99ros-sCFIj5bUBFxHJOWbWryd2WuKUjZJ3rLsEyMFucjP_Y7TGkWVB4QTTow_Bc="
  },
  "empty_sections": [],
  "excluded_topics": [],
  "covered_entities": [
    "Yayoi Kusama Inc.",
    "Leeum Museum of Art",
    "Comfy Org",
    "World Press Photo",
    "Art Omi"
  ],
  "repetition_notes": "关于 ComfyUI v0.34.0 的介绍，是对前几期简报中连续探讨的 MiniMax H3 底座及节点生态演进的纵深技术跟进（Follow-up），展现了算法控制从“盲盒生成”向帧级精确遮罩控制的跃迁。其余 4 个信号（包括草间弥生逝世、Leeum三星美术馆声音表演、世界新闻摄影展伦敦巡展、以及纽约 Art Omi 2027 驻留招募）均为全新的展览、历史事件与资助机会（New）。",
  "issue_number": 46
}
