{
  "date": "2026-10-24",
  "search_window": "7d",
  "reading_time": "约 8 分钟",
  "topics": [
    "母系记忆",
    "摄影物质性",
    "东亚摄影史",
    "开源 AI",
    "女性主义档案"
  ],
  "why_today": "今天的信号集中展现了图像与档案的物理沉淀与历史关联。从哈萨克斯坦对中亚母系关护与基础设施记忆的重构，到密尔沃基对摄影暗房物理开采史的剥离，再到波士顿美术馆完整呈现川田喜久治《地图》的编辑过程，艺术与研究正在重新回到物质、档案与劳动的现场。",
  "intro": "本期简报梳理了五项来自博物馆、开源社区与女性主义档案平台的最新动态。我们关注中亚母系叙事的空间建构、摄影媒介与矿产开采的物质纽带、川田喜久治摄影书档案的首次完整展示、开源 3D 几何细化工具对制作工作流的改善，以及 Secondary Archive 对青年女性艺术家的资助招募。",
  "opening_signal": "图像不仅记录历史，它本身就是由矿物、胶片与身体劳动共同构成的物理档案。",
  "closing_signal": "无论是暗房里的银与锂，还是战后摄影书的接触印相，媒介的物质痕迹提醒我们：档案不只是被看的图像，更是被制作、被关护的具体过程。",
  "stories": [
    {
      "section": "Feminist Structure Signal",
      "continuity": "New",
      "title_zh": "采琳尼当代艺术中心开幕《Himoya》特展：通过母系记忆与草地宇宙观重构女性关护与保护力量",
      "title_en": "Tselinny Center Presents 'Himoya: Matrilineal Energies, Oracular Kin'",
      "summary_zh": "哈萨克斯坦阿拉木图采琳尼当代艺术中心开幕由纳塔莎·金瓦拉策展的《Himoya》特展。展览汇集 21 位来自中亚及国际的艺术家与思考者，包括阿勒玛古尔·蒙利巴耶娃、阿齐扎·卡迪里与梁慧圭等。展品围绕母系记忆、关护劳动与草原前伊斯兰宇宙观展开。其中，卡迪里的互动装置《铁母亲》以其祖母作为塔什干电视塔首位女性主管的历史为切口，探讨技术基础设施中的家庭记忆。",
      "summary_en": "Tselinny Center of Contemporary Culture presents 'Himoya', an exhibition exploring matrilineal memory, care labor, and steppe cosmologies through works by 21 international and Central Asian artists.",
      "why_muki_cares": "项目将中亚母系记忆、关护实践与基建历史相结合。为研究非西方女性主义视觉、物质文化与媒体考古提供了具体的区域案例。",
      "editorial_signal": "中亚母系记忆与基础设施历史的交叉视角",
      "theme_tags": [
        "采琳尼当代艺术中心",
        "母系记忆",
        "关护劳动",
        "中亚艺术",
        "媒介考古",
        "阿齐扎·卡迪里",
        "梁慧圭"
      ],
      "source_name": "Tselinny Center of Contemporary Culture",
      "source_url": "https://vertexaisearch.cloud.google.com/grounding-api-redirect/AUZIYQFqyxXNVBvRrePXPJx34jJ5sn8OYk5RyyvNmXLF9dJuuyeH11qe5KWnB6bG6sXN1tCKNwD5yHkJSP1IZm4Ow8UW4qIeAigLCtD-L4cNcy7d-rdc9VjjDWLKVWES1-NJHijZCI7K-gP9X9DfDT1-WSVN4N5VlksceKhXK4gfdr5pIytt",
      "publication_date": "2026-10-15",
      "image_url": null,
      "image_caption": null
    },
    {
      "section": "Visual Culture Signal",
      "continuity": "New",
      "title_zh": "密尔沃基艺术博物馆开幕《Beneath the Surface》特展：通过 180 年摄影史揭示资源开采与暗房介质的物质联系",
      "title_en": "Milwaukee Art Museum Opens 'Beneath the Surface: Mining and American Photography'",
      "summary_zh": "密尔沃基艺术博物馆与美国国家美术馆联合举办《Beneath the Surface》特展。展览呈献 140 件跨越 180 年的摄影作品，涵盖玛丽·马丁利、卡拉·罗梅罗与卢卡斯·福格利亚等创作者。展览一方面记录矿山开采与石油钻探的视觉图像，另一方面揭示摄影媒介对提炼矿物的物理依赖，如胶片暗房对银的消耗，以及数字相机与电池对铜和锂的依赖。",
      "summary_en": "Co-organized with the National Gallery of Art, Milwaukee Art Museum presents 140 works examining both the visual history of mining and photography's material reliance on extracted minerals.",
      "why_muki_cares": "展览把摄影不只看作图像，而是看作依赖矿产开采的物质工业。这种媒介考古视角对理解暗房工艺与数字硬件的物理成本很有参考价值。",
      "editorial_signal": "摄影媒介的物理开采史与物质性研究",
      "theme_tags": [
        "密尔沃基艺术博物馆",
        "摄影史",
        "媒介物质性",
        "媒介考古",
        "暗房工艺",
        "资源开采",
        "环境视觉"
      ],
      "source_name": "Milwaukee Art Museum",
      "source_url": "https://vertexaisearch.cloud.google.com/grounding-api-redirect/AUZIYQG2kpbm-6d099fP-UPPkKAK_26-mWRTr73SBbe2mD5qs2HQCw-sNOtuGnvtK86ba7TOVCDOzWwsA4jVetLgl-1DxZVSZxVPOAIysinmAe_bgimo71QIdXCdmRWpGozq5W3jiFtGg1I=",
      "publication_date": "2026-10-23",
      "image_url": null,
      "image_caption": null
    },
    {
      "section": "China / East Asia Signal",
      "continuity": "New",
      "title_zh": "波士顿美术馆开幕川田喜久治《地图》档案展：首次完整公开 1965 年摄影书手稿与接触印相",
      "title_en": "MFA Boston Opens 'Kawada Kikuji: Chizu (The Map)' Archive Exhibition",
      "summary_zh": "波士顿美术馆开幕日本摄影师川田喜久治的《地图》（Chizu）专题档案展。展览依托博物馆新入藏的川田喜久治档案，完整展出 87 幅战后银盐原作、原始底片、接触印相、私人工作文件夹及 1965 年初版《地图》摄影书。作品围绕广岛原爆遗址、东京湾要塞与战后日本社会展开，呈现图像从底片到书籍排版的完整制作过程。",
      "summary_en": "MFA Boston opens an exhibition dedicated to Kawada Kikuji's 1965 photobook 'Chizu', displaying 87 vintage prints alongside contact sheets, film negatives, and working binders.",
      "why_muki_cares": "《地图》是东亚摄影书史的里程碑。此次展出的接触印相与工作手稿，为研究摄影书的编辑排版、图像序列与档案物质性提供了第一手文献。",
      "editorial_signal": "东亚战后摄影书编辑排版与暗房档案研究",
      "theme_tags": [
        "波士顿美术馆",
        "川田喜久治",
        "地图",
        "摄影书",
        "东亚视觉文化",
        "接触印相",
        "档案研究"
      ],
      "source_name": "Museum of Fine Arts, Boston",
      "source_url": "https://vertexaisearch.cloud.google.com/grounding-api-redirect/AUZIYQEXs4QVF6-Yg6Y-5Rg9uijCo9CVNY1gVZ70KfHBKxIgGWTNblrV8ZRx6MsWDPtvBCP2tJ_oGWbLBabtk8jxrYlq_c_B1OWxv5PhBuzlnJhvDh_sntj_A0iRnil9TiJxDLcMlRCa3y2QBc0FJVtRxMzY",
      "publication_date": "2026-10-24",
      "image_url": null,
      "image_caption": null
    },
    {
      "section": "AI Research / Creative Tech Signal",
      "continuity": "New",
      "title_zh": "Hi3D 团队开源 Hi3D v1.0 三维细化模型：以 1536³ 高精网格与 200 万 3D 资产优化 3D 创作工作流",
      "title_en": "Hi3D Open-Sources Hi3D v1.0 Geometry Refinement Model for High-Resolution 3D Workflows",
      "summary_zh": "Hi3D 团队开源 Hi3D v1.0 模型。该模型基于 Sparc3D 架构，使用约 200 万个三维资产训练。模型作为二阶段几何细化工具，可接收粗糙 3D 网格（如 Hunyuan3D 或 TRELLIS 输出）与单张参考图，将其重建为最高 1536³ 分辨率的高精表面网格，切片成功率达 90%。",
      "summary_en": "The Hi3D team open-sourced Hi3D v1.0, a geometry refinement model designed to upscale coarse 3D meshes to 1536³ grid resolution for 3D printing and spatial asset design.",
      "why_muki_cares": "工具解决了生成式 3D 模型边缘模糊与几何结构混乱的问题。在本地工作流中接入该模型，可直接提升 3D 打印与空间设计资产的实用度。",
      "editorial_signal": "生成式 3D 几何细化与开源工作流落地",
      "theme_tags": [
        "Hi3D",
        "开源 AI",
        "3D 建模",
        "几何细化",
        "创意技术",
        "工作流优化",
        "三维打印"
      ],
      "source_name": "PR Newswire",
      "source_url": "https://vertexaisearch.cloud.google.com/grounding-api-redirect/AUZIYQEkW8te6BG3A6PaRvGai9Br38RHAFc4V3RnU038JwBG28efcP_vziWyC_2cIzCuKyfN1QifEv4GiUdIOMLhT2PtJ1obpLpZsKgHD-yKxASJ4OX1tMj3QB2YUWP50CIBGhU6rZQ_1dV-KeRv3vzvIXzebxqmwLkTK6WZ1Kj_8ySrDAkXy6GI0_9PYq9QupoI95L5OvK4xDbu7vVjOJTjW7W4NP0SBp_571MYTEwkKkm-iTH0i-VCcVUsF76xfh0fz8w=",
      "publication_date": "2026-10-23",
      "image_url": null,
      "image_caption": null
    },
    {
      "section": "Archive / Long Read / Opportunity",
      "continuity": "New",
      "title_zh": "Secondary Archive 启动中东欧与南欧青年女性艺术家征集：提供 500 欧元资助与华沙特展机会",
      "title_en": "Secondary Archive Launches Open Call for Emerging Women Artists in Central and Eastern Europe",
      "summary_zh": "由卡塔芝娜·柯兹拉基金会发起的 Secondary Archive 平台启动新一轮公开招募。项目面向中东欧、西巴尔干与东部伙伴关系等 13 个国家的 35 岁及以下女性视觉艺术家。入选者将与策展人合作撰写艺术陈述并录制视频，入驻永久数字档案库，获得 500 欧元资助，并参加 2027 年 3 月 8 日在华沙举办的群展。申请截止日期为 2026 年 11 月 15 日。",
      "summary_en": "Secondary Archive invites female-identifying artists aged 35 and under from 13 CEE countries to submit for its digital archive, offering a €500 grant and a Warsaw exhibition.",
      "why_muki_cares": "Secondary Archive 是非西方女性艺术家反向档案的优秀建构模式。项目直接资助青年创作者，并建立长期的数字文献数据库。",
      "editorial_signal": "女性主义反向档案与青年艺术家资助机制",
      "theme_tags": [
        "Secondary Archive",
        "女性主义档案",
        "反向档案",
        "公开招募",
        "艺术资助",
        "中东欧艺术",
        "数字档案"
      ],
      "source_name": "Secondary Archive",
      "source_url": "https://vertexaisearch.cloud.google.com/grounding-api-redirect/AUZIYQH4NVBpysrQwe8LoENSQn3Uu4stdbpfkVixpy7sUP4RhyLdGj-nFtb9KNinl8UHCV0pBQbOMb09nrzr4NWPz-N9hEuA64mSFXIJOT_FSnVe6onugurqPnV6-pNiXCU47GOlJRiknYTgdzzryNKroqPr9Q8JdP40rMoaXZdOVLPksLGWHuoivhg=",
      "publication_date": null,
      "image_url": null,
      "image_caption": null
    }
  ],
  "editors_pick": {
    "type": "China / East Asia Signal",
    "title": "波士顿美术馆开幕川田喜久治《地图》档案展：首次完整公开 1965 年摄影书手稿与接触印相",
    "why_muki_may_care": "展出完整接触印相与私人工作手稿，直观呈现了摄影书排版与图像序列的构想过程，是研究东亚暗房史与摄影书编辑的具体案例。",
    "link": "https://vertexaisearch.cloud.google.com/grounding-api-redirect/AUZIYQEXs4QVF6-Yg6Y-5Rg9uijCo9CVNY1gVZ70KfHBKxIgGWTNblrV8ZRx6MsWDPtvBCP2tJ_oGWbLBabtk8jxrYlq_c_B1OWxv5PhBuzlnJhvDh_sntj_A0iRnil9TiJxDLcMlRCa3y2QBc0FJVtRxMzY"
  },
  "empty_sections": [],
  "excluded_topics": [],
  "covered_entities": [
    "Tselinny Center of Contemporary Culture",
    "Milwaukee Art Museum",
    "National Gallery of Art",
    "Museum of Fine Arts, Boston",
    "Hi3D Team",
    "Secondary Archive",
    "Katarzyna Kozyra Foundation"
  ],
  "repetition_notes": "本期收录的 5 项信号均为全新录入信号（New）。其中波士顿美术馆对川田喜久治档案的展示，进一步扩展了对东亚战后摄影书与暗房物质性的长线追踪。",
  "issue_number": 86
}
