{
  "date": "2026-09-11",
  "search_window": "7d",
  "reading_time": "约 8 分钟",
  "topics": [
    "女性主义艺术展",
    "媒介考古与影像",
    "开源工作流",
    "王武生银盐原作",
    "学术驻留公募"
  ],
  "why_today": "今天的信号聚焦于历史边缘与传统介质的系统性打捞。Hammer Museum 启动了两位已故女性抽象先驱的学术重建；三影堂通过王武生的黑白银盐原作呈现古典山水脉络的媒介转译；顶级学术驻留 Camargo 则开启了最后一届公开招募。这些动态表明独立创作与学术资源正在发生系统性重构。与此同时，开源社区对 Viggle-Animate 节点的本地化优化，为低算力条件下的独立影像创作提供了技术支持。",
  "intro": "今天我们关注现代艺术史的重新发掘与本地创作流的优化。Hammer Museum 重建了两位失落女性艺术家的几何抽象叙事。三影堂通过王武生个展开展银盐影像的媒介考古。在技术底层，ComfyUI-Viggle-Animate-H3 的开源降低了长视频角色控制的算力门槛。最后，法国卡马戈基金会启动最后一届公开招募，为独立研究者提供了宝贵的申请机会。",
  "opening_signal": "有些档案必须在它被系统彻底封闭前，用我们自己的手写完。 Some archives must be hand-written by ourselves before they are completely closed by the system.",
  "closing_signal": "当机构的大门逐渐从“公开申请”退回“内部提名”，我们更需要本地、开源且不依赖外部订阅的创作工具，在自己的终端里守住独立表意的空间。",
  "stories": [
    {
      "section": "Feminist Structure Signal",
      "continuity": "New",
      "title_zh": "Hammer Museum 公布秋季大展：推出 Huguette Caland 与 Mavis Pusey 抽象双回顾展",
      "title_en": "Hammer Museum Announces Fall 2026 Lineup: Twin Retrospectives for Huguette Caland and Mavis Pusey",
      "summary_zh": "洛杉矶 Hammer Museum 公布了 2026 年秋季展览排期，重点推出两位已故抽象女性艺术家的双回顾展。黎巴嫩裔艺术家 Huguette Caland 的展览将展出约 150 件素描、绘画及手绘人体长袍，探讨她如何以情色线描和感官抽象挑战性别规范与肉体限制。牙买加裔美国艺术家 Mavis Pusey 的展览是其在西海岸的首次大型调查展，展出 60 余件作品，呈现她在黑人具象艺术主流时代如何坚持用几何抽象映射都市废墟与剧烈社会变迁。",
      "summary_en": "The Hammer Museum in Los Angeles announced its fall 2026 exhibition lineup, featuring major retrospectives for deceased abstract female artists Huguette Caland and Mavis Pusey, exploring themes of bodily abstraction and urban deconstruction.",
      "why_muki_cares": "提供了失落女性现代主义抽象史的绝佳个案。策展团队对 Pusey 长达十年的学术打捞，以及平行项目 Gê Viana 将档案视作不完整建构的拼贴实践，高度切合我们对“女性劳作、未写就的活态档案”的研究兴趣。",
      "editorial_signal": "机构正在系统性重构和填补 20 世纪女性抽象艺术和边缘历史叙事的空白。",
      "theme_tags": [
        "Hammer Museum",
        "Huguette Caland",
        "Mavis Pusey",
        "女性主义策展",
        "几何抽象",
        "身体政治",
        "现代艺术史",
        "档案重建"
      ],
      "source_name": "Hammer Museum",
      "source_url": "https://vertexaisearch.cloud.google.com/grounding-api-redirect/AUZIYQHiG6l5hQBtVsnrKf8i3Sl854pnX4tBYhXkYy3ZruyLLU4Hg0SIaC1vKwJQla4n-EQampiwe2_wuoruUuqkpGJUvgkpOlfCxx8F3PGtaAFaeQew5vOa73h9Zif6t1XHfXzqteoVU1430JlvYs_CEU0LYwY5uuMIQSvU9BRgt4rQXfi-JYxfVwmwlc0sM-Gn_TarRZILgEJxKIlr5nQo8DwdLzLpY3_gEoc=",
      "publication_date": "2026-09-10",
      "image_url": null,
      "image_caption": null
    },
    {
      "section": "China / East Asia Signal",
      "continuity": "New",
      "title_zh": "三影堂举办王武生原作展：巫鸿策展，重温黑白银盐对古典山水画脉络的媒介转换",
      "title_en": "Three Shadows Presents Wang Wusheng's Vintage Photographs: Curated by Wu Hung on Gelatin Silver and Landscape Lineage",
      "summary_zh": "北京三影堂摄影艺术中心于 2026 年 9 月 5 日至 11 月 8 日举办已故摄影家王武生个展《山之生：王武生的复古原作》，由艺术史学家巫鸿担任策展人。展览展出王武生在 1970 至 1990 年代创作的 60 幅黑白银盐原作。巫鸿指出，王武生的摄影实践承袭了 17 世纪起中国黄山山水画的笔墨脉络，并在机械复制时代用克制的银盐工艺实现了古典美学的现代媒介转译。",
      "summary_en": "Three Shadows Photography Art Centre in Beijing presents Wang Wusheng's first posthumous solo exhibition, curated by Wu Hung, showcasing 60 gelatin silver prints that translate 17th-century Chinese ink landscape traditions into modern photographic medium.",
      "why_muki_cares": "这一展览提供了一个如何利用西方化学工艺进行东方古典意境（散点透视、墨色变化）重构的媒介考古范式，巫鸿的策展框架在理解地缘视觉和代际转化上具有权威学术参考价值。",
      "editorial_signal": "在数字摄影泛滥的当下，重回物理银盐暗房的克制质感，正在成为重构东方地缘美学史和当代摄影史的关键路径。",
      "theme_tags": [
        "王武生",
        "三影堂",
        "巫鸿",
        "黑白银盐",
        "媒介考古",
        "山水画",
        "当代中国摄影"
      ],
      "source_name": "China Daily",
      "source_url": "https://vertexaisearch.cloud.google.com/grounding-api-redirect/AUZIYQEcj7fwfX4RHXUQD0xonNi0p23rISXl7bgsE19bR4ZmR1BhrcNZUTeGZi0p_5atfpEC2-Q-3Djz7RF25iwwSx3BqE6uaTAaqqgqz-6ZFvEF39A9oqgwDO6JaGArvQVkWJMZoXyA08fSGaLl48Fm7UFYuHYlCZcY9logM2bSfig=",
      "publication_date": "2026-09-10",
      "image_url": null,
      "image_caption": null
    },
    {
      "section": "AI Research / Creative Tech Signal",
      "continuity": "Follow-up",
      "title_zh": "开源节点 ComfyUI-Viggle-Animate-H3 发布：在本地实现 24G 显卡下的长视频角色替换",
      "title_en": "Open-Source ComfyUI-Viggle-Animate-H3 Released: Local Character Replacement for Long Videos under 24GB VRAM",
      "summary_zh": "开源开发者 Saganaki22 发布并更新了 ComfyUI-Viggle-Animate-H3 节点包。该工具基于 Viggle-Animate 模型，专用于在本地对视频进行高精度的角色替换与动力学重合。其新发布的窗口化变体（Windowed Variant）通过在重组时复用前一个 overlapping 窗口已编码的 17 帧 VAE 模块，避免了冗余计算，打破了原生节点 124 帧的物理限制。配合 pruned int8（20.3 GB）模型与 DMD2 LoRA，它允许用户在 24GB 显卡下进行 4 步快速长视频动画生成。",
      "summary_en": "Developer Saganaki22 released ComfyUI-Viggle-Animate-H3, an open-source tool enabling local, high-precision character video replacement on 24GB VRAM GPUs by reusing cached VAE blocks across windowed segments.",
      "why_muki_cares": "该工具打破了封闭式云端服务的垄断，将复杂的角色动力学与局部重绘完全本地化。其“VAE 缓存复用”的窗口化方案，为多模态智能体工作流在低算力下维持多帧一致性、控制局部幻觉提供了极好的技术参考。",
      "editorial_signal": "视频角色的精准控制工作流正加速从云端订阅制向本地开源和低算力平民化转型。",
      "theme_tags": [
        "ComfyUI",
        "Viggle-Animate",
        "MiniMax H3",
        "开源模型",
        "视频生成",
        "工作流优化",
        "算力普惠"
      ],
      "source_name": "GitHub (Saganaki22)",
      "source_url": "https://vertexaisearch.cloud.google.com/grounding-api-redirect/AUZIYQGtSvp4Cm9jB_ej8JC4wOBAHbmyCDWR8E1-yVKh7GEyoRr2NQkrGRV4uJMdM9XmlLh0HT6JaVLmZoBD6Gfdr-vIdqWVh4IBRU6ivU1bDdN9RbkTSNGcwX55C1nYnnhU2yANBUyIdAxkFns=",
      "publication_date": "2026-09-09",
      "image_url": null,
      "image_caption": null
    },
    {
      "section": "Archive / Long Read / Opportunity",
      "continuity": "New",
      "title_zh": "Camargo Fellowship 启动最后一届公开招募：全额资助艺术与跨界学者赴法开展 10 周研究",
      "title_en": "Camargo Fellowship Launches Its Final Public Open Call: Fully Funding Artists and Scholars for 10-Week Residencies",
      "summary_zh": "法国卡马戈基金会启动了其旗舰项目“卡马戈奖学金（Camargo Fellowship）”的 2027-2028 年度公开招募，截止日期为 2026 年 10 月 1 日。本轮计划资助 7 位艺术家和 7 位学者/思想家赴法国卡西斯开展为期 10 周的独立、无硬性指标的研究与创作。项目提供每周 350 欧元津贴、交通补助及带独立暗房等配套的海景公寓。这也是该奖学金历史上最后一次面向公众的公开申请，此后项目将全面转为“不公开提名制”。",
      "summary_en": "The Camargo Foundation announced the 2027-2028 open call for the Camargo Fellowship, fully funding 10-week residencies in Cassis, France. Notably, this is the final public open call in the program's history.",
      "why_muki_cares": "该项目是极为罕见的不设硬性产出考核、纯研究导向的顶级国际驻留。由于这是历史上最后一届公募（此后全面转向黑箱提名），对需要安静独立研究空间和暗房设施的跨学科研究者与艺术家来说，是必须把握的时效性窗口。",
      "editorial_signal": "顶级国际学术艺术驻留正在收紧公开申请通道、转向提名制，这说明独立创作者直接对接无门槛学术资源的空间正在进一步被机构壁垒挤压。",
      "theme_tags": [
        "Camargo Foundation",
        "艺术驻留",
        "开放招募",
        "跨学科研究",
        "学术自由",
        "地缘研究"
      ],
      "source_name": "The Camargo Foundation",
      "source_url": "https://vertexaisearch.cloud.google.com/grounding-api-redirect/AUZIYQHuozqXgp4V2Te4pElv46cUm9X7DduU7ufXv34QIIyEzics40DKSVX0_ZNn4OwHlbNgbBo1EDqDnnmtEKCqSJI2Pg74xnYr_DiUgyPTsqXIcexyZwxCKnaSUbtiv62-_K10aKSd_HaRpKOpENuZSIb_6_7i",
      "publication_date": "2026-09-10",
      "image_url": null,
      "image_caption": null
    }
  ],
  "editors_pick": {
    "type": "Archive / Long Read / Opportunity",
    "title": "Camargo Fellowship 启动最后一届公开招募：全额资助艺术与跨界学者赴法开展 10 周研究",
    "why_muki_may_care": "这是顶级纯研究驻留项目历史上最后一次公开招募。对于不愿受制于硬性产出指标、渴望地中海宁静创作和暗房空间的跨学科学者与艺术家，此乃最后的黄金窗口。",
    "link": "https://vertexaisearch.cloud.google.com/grounding-api-redirect/AUZIYQHuozqXgp4V2Te4pElv46cUm9X7DduU7ufXv34QIIyEzics40DKSVX0_ZNn4OwHlbNgbBo1EDqDnnmtEKCqSJI2Pg74xnYr_DiUgyPTsqXIcexyZwxCKnaSUbtiv62-_K10aKSd_HaRpKOpENuZSIb_6_7i"
  },
  "empty_sections": [
    "Visual Culture Signal"
  ],
  "excluded_topics": [
    "Idemitsu Mako: What a Woman Made (Autobiography of a Video Artist) - 排除原因：出光真子在东京都写真美术馆的回顾展是强烈的女性主义策展与媒介考古信号，但已在 2026-09-09 简报中作为核心头条推荐过，根据避免在一周内重复推荐同一机构和艺术家的政策予以排除。"
  ],
  "covered_entities": [
    "Hammer Museum",
    "Three Shadows Photography Art Centre",
    "Saganaki22",
    "The Camargo Foundation"
  ],
  "repetition_notes": "关于 ComfyUI-Viggle-Animate-H3 的功能更新，是对 8 月 31 日、9 月 4 日、7 日及 10 日简报中涉及 MiniMax H3 底层逻辑及开源应用生态的纵深技术跟踪（Follow-up），展示了本地开源社区通过 VAE 模块缓存和窗口化设计在低算力下打通长视频角色替换闭环的技术突围。其余 3 项信号（包括 Hammer Museum 女性抽象双展、三影堂王武生原作展，以及 Camargo 最后一届公募）均为全新的展览策划、地缘艺术梳理与顶级资助机会（New）。",
  "issue_number": 59
}
